TOM!	Polly
Becky, won't you say something?	Tom
Please, Becky, won't you take it?	Tom
Tom! Come back, Tom!	Becky
What hasn't come here, come! What's here, stay here!	Tom
Well, that beats anything!	Tom
Doodle-bug, doodle-bug, tell me what I want to know! Doodle-bug, doodle-bug, tell me what I want to know!	Tom
He dasn't tell! So it _was_ a witch that done it. I just knowed it.	Tom
Brother, go find your brother!	Tom
Hold, my merry men! Keep hid till I blow.	Tom
Hold! Who comes here into Sherwood Forest without my pass?	Tom
Guy of Guisborne wants no man's pass. Who art thou that--that--	JoeHarper
I sha'n't! Why don't you fall yourself? You're getting the worst of it.	JoeHarper
Why, that ain't anything. I can't fall; that ain't the way it is in the book. You're to turn around and let me hit you in the back.	Tom
Now, you got to let me kill _you_. That's fair.	JoeHarper
Why, I can't do that, it ain't in the book.	Tom
Well, it's blamed mean--that's all.	JoeHarper
Well, say, Joe, you can be Friar Tuck or Much the miller's son, and lam me with a quarter-staff; or I'll be the Sheriff of Nottingham and you be Robin Hood a little while and kill me.	Tom
Hucky, do you believe the dead people like it for us to be here?	Tom I wisht I knowed. It's awful solemn like, _ain't_ it?	Huck I bet it is.	Tom Say, Hucky--do you reckon Hoss Williams hears us talking?	Tom O' course he does. Least his sperrit does.	Huck I wish I'd said Mister Williams. But I never meant any harm. Everybody calls him Hoss.	Tom
A body can't be too partic'lar how they talk 'bout these-yer dead people, Tom.	Huck
What is it, Tom?	Huck
Sh! There 'tis again! Didn't you hear it?	Tom
I--	Huck
There! Now you hear it.	Tom
Lord, Tom, they're coming! They're coming, sure. What'll we do?	Huck
I dono. Think they'll see us?	Tom
Oh, Tom, they can see in the dark, same as cats. I wisht I hadn't come.	Huck
Oh, don't be afeard. I don't believe they'll bother us. We ain't doing any harm. If we keep perfectly still, maybe they won't notice us at all.	Tom
I'll try to, Tom, but, Lord, I'm all of a shiver.	Huck
Listen!	Tom
Look! See there! What is it?	Tom
It's devil-fire. Oh, Tom, this is awful.	Huck
It's the devils sure enough. Three of 'em! Lordy, Tom, we're goners! Can you pray?	Huck
I'll try, but don't you be afeard. They ain't going to hurt us. 'Now I lay me down to sleep, I--'	Tom
Sh!	Huck
What is it, Huck?	Tom
They're _humans_! One of 'em is, anyway. One of 'em's old Muff Potter's voice.	Huck
No--'tain't so, is it?	Tom
I bet I know it. Don't you stir nor budge. He ain't sharp enough to notice us. Drunk, the same as usual, likely--blamed old rip!	Huck
All right, I'll keep still. Now they're stuck. Can't find it. Here they come again. Now they're hot. Cold again. Hot again. Red hot! They're p'inted right, this time. Say, Huck, I know another o' them voices; it's Injun Joe.	Tom
That's so--that murderin' half-breed! I'd druther they was devils a dern sight. What kin they be up to?	Huck
Hurry, men! the moon might come out at any moment.	DrRobinson
Now the cussed thing's ready, Sawbones, and you'll just out with another five, or here she stays.	Potter
That's the talk!	InjunJoe
Look here, what does this mean?	DrRobinson
You required your pay in advance, and I've paid you.	DrRobinson
Yes, and you done more than that. Five years ago you drove me away from your father's kitchen one night, when I come to ask for something to eat, and you said I warn't there for any good; and when I swore I'd get even with you if it took a hundred years, your father had me jailed for a vagrant. Did you think I'd forget? The Injun blood ain't in me for nothing. And now I've _got_ you, and you got to _settle_, you know!	InjunJoe
Here, now, don't you hit my pard!	Potter
_That_ score is settled--damn you.	InjunJoe
Lord, how is this, Joe?	Potter
It's a dirty business. What did you do it for?	InjunJoe
I! I never done it!	Potter
Look here! That kind of talk won't wash.	InjunJoe
I thought I'd got sober. I'd no business to drink to-night. But it's	 in my head yet--worse'n when we started here. I'm all in a muddle;	 can't recollect anything of it, hardly. Tell me, Joe--_honest_, now,	 old feller--did I do it? Joe, I never meant to--'pon my soul and honor, I	 never meant to, Joe. Tell me how it was, Joe. Oh, it's awful--and him so	 young and promising.	Potter
Why, you two was scuffling, and he fetched you one with the headboard and you fell flat; and then up you come, all reeling and staggering like, and snatched the knife and jammed it into him, just as he fetched you another awful clip--and here you've laid, as dead as a wedge til now.	InjunJoe
Oh, I didn't know what I was a-doing. I wish I may die this minute if I did. It was all on account of the whiskey and the excitement, I reckon. I never used a weepon in my life before, Joe. I've fought, but never with weepons. They'll all say that. Joe, don't tell! Say you won't tell, Joe--that's a good feller. I always liked you, Joe, and stood up for you, too. Don't you remember? You _won't_ tell, _will_ you, Joe?	Potter
No, you've always been fair and square with me, Muff Potter, and I won't go back on you. There, now, that's as fair as a man can say.	InjunJoe
Oh, Joe, you're an angel. I'll bless you for this the longest day I live.	Potter
Come, now, that's enough of that. This ain't any time for blubbering. You be off yonder way and I'll go this. Move, now, and don't leave any tracks behind you.	InjunJoe
If he's as much stunned with the lick and fuddled with the rum as he had the look of being, he won't think of the knife till he's gone so far he'll be afraid to come back after it to such a place by himself--chicken-heart!	InjunJoe
If we can only get to the old tannery before we break down!	Tom
I can't stand it much longer.	Tom
Huckleberry, what do you reckon'll come of this?	Tom
If Doctor Robinson dies, I reckon hanging'll come of it.	Huck
Do you though?	Tom
Why, I _know_ it, Tom.	Huck
Who'll tell? We?	Tom
What are you talking about? S'pose something happened and Injun Joe _didn't_ hang? Why, he'd kill us some time or other, just as dead sure as we're a laying here.	Huck
That's just what I was thinking to myself, Huck.	Tom
If anybody tells, let Muff Potter do it, if he's fool enough. He's generally drunk enough.	Huck
Huck, Muff Potter don't know it. How can he tell?	Tom
What's the reason he don't know it?	Huck
Because he'd just got that whack when Injun Joe done it. D'you reckon he could see anything? D'you reckon he knowed anything?	Tom
By hokey, that's so, Tom!	Huck
And besides, look-a-here--maybe that whack done for _him_!	Tom
No, 'taint likely, Tom. He had liquor in him; I could see that; and besides, he always has. Well, when pap's full, you might take and belt him over the head with a church and you couldn't phase him. He says so, his own self. So it's the same with Muff Potter, of course. But if a man was dead sober, I reckon maybe that whack might fetch him; I dono.	Huck
Hucky, you sure you can keep mum?	Tom
Tom, we _got_ to keep mum. You know that. That Injun devil wouldn't make any more of drownding us than a couple of cats, if we was to squeak 'bout this and they didn't hang him. Now, look-a-here, Tom, less take and swear to one another--that's what we got to do--swear to keep mum.	Huck
I'm agreed. It's the best thing. Would you just hold hands and swear that we--	Tom
Oh no, that wouldn't do for this. That's good enough for little rubbishy common things--specially with gals, cuz _they_ go back on you anyway, and blab if they get in a huff--but there orter be writing 'bout a big thing like this. And blood.	Huck
Hold on! Don't do that. A pin's brass. It might have verdigrease on it.	Tom
What's verdigrease?	Huck
It's p'ison. That's what it is. You just swaller some of it once--you'll see.	Tom
Tom does this keep us from _ever_ telling--_always_?	Huck
Of course it does. It don't make any difference _what_ happens, we got to keep mum. We'd drop down dead--don't _you_ know that?	Tom
Yes, I reckon that's so.	Huck
Which of us does he mean?	Huck
I dono--peep through the crack. Quick!	Tom
No, _you_, Tom!	Huck
I can't--I can't _do_ it, Huck!	Tom
Please, Tom. There 'tis again!	Huck
Oh, lordy, I'm thankful!	Tom
I know his voice. It's Bull Harbison.	Tom
Oh, that's good--I tell you, Tom, I was most scared to death; I'd a bet anything it was a _stray_ dog.	Huck
Oh, my! that ain't no Bull Harbison!	Huck
Oh, Huck, _its a stray dog_!	Tom
Quick, Tom, quick! Who does he mean?	Huck
Huck, he must mean us both--we're right together.	Tom
Oh, Tom, I reckon we're goners. I reckon there ain't no mistake 'bout where _I'll_ go to. I been so wicked.	Huck
Dad fetch it! This comes of playing hookey and doing everything a feller's told _not_ to do. I might a been good, like Sid, if I'd a tried--but no, I wouldn't, of course. But if ever I get off this time, I lay I'll just _waller_ in Sunday-schools!	Tom
_You_ bad!	Huck
Consound it, Tom Sawyer, you're just old pie, 'long-side o' what I am. Oh, _lordy_, lordy, lordy, I wisht I only had half your chance.	Huck
Look, Hucky, look! He's got his _back_ to us!	Tom
Well, he has, by jingoes! Did he before?	Huck
Yes, he did. But I, like a fool, never thought. Oh, this is bully, you know. _Now_ who can he mean?	Tom
Sh! What's that?	Tom
Sounds like--like hogs grunting. No--it's somebody snoring, Tom.	Huck
That _is_ it! Where 'bouts is it, Huck?	Tom
I bleeve it's down at 'tother end. Sounds so, anyway. Pap used to sleep there, sometimes, 'long with the hogs, but laws bless you, he just lifts things when _he_ snores. Besides, I reckon he ain't ever coming back to this town any more.	Huck
Hucky, do you das't to go if I lead?	Tom
I don't like to, much. Tom, s'pose it's Injun Joe!	Huck
Oh, geeminy, it's _him_!	HuckTom
Say, Tom--they say a stray dog come howling around Johnny Miller's house, 'bout midnight, as much as two weeks ago; and a whippoorwill come in and lit on the banisters and sung, the very same evening; and there ain't anybody dead there yet.	Huck
Well, I know that. And suppose there ain't. Didn't Gracie Miller fall in the kitchen fire and burn herself terrible the very next Saturday?	Tom
Yes, but she ain't _dead_. And what's more, she's getting better, too.	Huck
All right, you wait and see. She's a goner, just as dead sure as Muff Potter's a goner. That's what the niggers say, and they know all about these kind of things, Huck.	Tom
I didn't do it, friends, 'pon my word and honor I never done it.	Potter
Oh, Injun Joe, you promised me you'd never--	Potter
Tom, you pitch around and talk in your sleep so much that you keep me awake half the time.	Sidney
Something told me 't if I didn't come back and get-- Tell 'em, Joe, tell 'em--it ain't any use any more.	Potter
I couldn't help it--I couldn't help it. I wanted to run away, but I couldn't seem to come anywhere but here.	Potter
It's a bad sign. What you got on your mind, Tom?	Polly
Nothing. Nothing 't I know of.	Tom
And you do talk such stuff. You said that over and over. Tell _what_? What is it you'll tell?	Sidney
Sho! It's that dreadful murder. I dream about it most every night myself. Sometimes I dream it's me that done it.	Polly
Don't ask for it unless you want it, Peter.	Tom
You better make sure.	Tom
Now you've asked for it, and I'll give it to you, because there ain't anything mean about me; but if you find you don't like it, you mustn't blame anybody but your own self.	Tom
Tom, what on earth ails that cat?	Polly
I don't know, aunt.	Tom
Why, I never see anything like it. What did make him act so?	Polly
Deed I don't know, Aunt Polly; cats always act so when they're having a good time.	Tom
They do, do they?	Polly
Yes'm. That is, I believe they do.	Tom
You _do_?	Polly
Yes'm.	Tom
Now, sir, what did you want to treat that poor dumb beast so, for?	Polly
I done it out of pity for him--because he hadn't any aunt.	Tom
Hadn't any aunt!--you numskull. What has that got to do with it?	Polly
Heaps. Because if he'd had one she'd a burnt him out herself! She'd a roasted his bowels out of him 'thout any more feeling than if he was a human!	Tom
I was meaning for the best, Tom. And, Tom, it _did_ do you good.	Polly
I know you was meaning for the best, aunty, and so was I with Peter. It done _him_ good, too. I never see him get around so since--	Tom
Oh, go 'long with you, Tom, before you aggravate me again. And you try and see if you can't be a good boy, for once, and you needn't take any more medicine.	Polly
Tom Sawyer, the Black Avenger of the Spanish Main. Name your names.	Tom
'Tis well. Give the countersign.	Tom
Luff, and bring her to the wind!	Tom
Aye-aye, sir!	JoeHuck
Steady, steady-y-y-y!	Tom
Steady it is, sir!	JoeHuck
Let her go off a point!	Tom
Point it is, sir!	JoeHuck
What sail's she carrying?	Tom
Courses, tops'ls, and flying-jib, sir.	JoeHuck
Send the r'yals up! Lay out aloft, there, half a dozen of ye--foretopmaststuns'l! Lively, now!	Tom
Aye-aye, sir!	JoeHuck
Shake out that maintogalans'l! Sheets and braces! _now_ my hearties!	Tom
Aye-aye, sir!	JoeHuck
Hellum-a-lee--hard a port! Stand by to meet her when she comes! Port, port! _Now_, men! With a will! Stead-y-y-y!	Tom
Steady it is, sir!	JoeHuck
_Ain't_ it gay?	JoeHarper
It's _nuts_!	Tom
What would the boys say if they could see us?	Tom
Say? Well, they'd just die to be here--hey, Hucky!	JoeHarper
I reckon so, anyways, I'm suited. I don't want nothing better'n this. I don't ever get enough to eat, gen'ally--and here they can't come and pick at a feller and bullyrag him so.	Huck
It's just the life for me. You don't have to get up, mornings, and you don't have to go to school, and wash, and all that blame foolishness. You see a pirate don't have to do _anything_, Joe, when he's ashore, but a hermit _he_ has to be praying considerable, and then he don't have any fun, anyway, all by himself that way.	Tom
Oh yes, that's so, but I hadn't thought much about it, you know. I'd a good deal rather be a pirate, now that I've tried it.	JoeHarper
You see, people don't go much on hermits, nowadays, like they used to in old times, but a pirate's always respected. And a hermit's got to sleep on the hardest place he can find, and put sackcloth and ashes on his head, and stand out in the rain, and--	Tom
What does he put sackcloth and ashes on his head for?	Huck
I dono. But they've _got_ to do it. Hermits always do. You'd have to do that if you was a hermit.	Tom
Dern'd if I would	Huck
Well, what would you do?	Tom
I dono. But I wouldn't do that.	Huck
Why, Huck, you'd _have_ to. How'd you get around it?	Tom
Why, I just wouldn't stand it. I'd run away.	Huck
Run away! Well, you _would_ be a nice old slouch of a hermit. You'd be a disgrace.	Tom
What does pirates have to do?	Huck
Oh, they have just a bully time--take ships and burn them, and get the money and bury it in awful places in their island where there's ghosts and things to watch it, and kill everybody in the ships--make 'em walk a plank.	Tom
And they carry the women to the island, they don't kill the women.	JoeHarper
No, they don't kill the women--they're too noble. And the women's always beautiful, too.	Tom 
And don't they wear the bulliest clothes! Oh no! All gold and silver and di'monds.	JoeHarper
Who?	Huck
Why, the pirates.	JoeHarper
I reckon I ain't dressed fitten for a pirate, but I ain't got none but these.	Huck
What is it!	JoeHarper
I wonder	Tom
'Tain't thunder, becuz thunder--	Huck Hark!	Tom Listen--don't talk.	Tom Let's go and see.	Tom I know now!	Tom That's it!	Huck they done that last summer, when Bill Turner got drownded; they shoot a cannon over the water, and that makes him come up to the top. Yes, and they take loaves of bread and put quicksilver in 'em and set 'em afloat, and wherever there's anybody that's drownded, they'll float right there and stop.	Huck
Yes, I've heard about that. I wonder what makes the bread do that.	JoeHarper
Oh, it ain't the bread, so much, I reckon it's mostly what they _say_ over it before they start it out.	Tom
But they don't say anything over it. I've seen 'em and they don't.	Huck
Well, that's funny. But maybe they say it to themselves. Of _course_ they do. Anybody might know that.	Tom
By jings, I wish I was over there, now,	JoeHarper
I do too. I'd give heaps to know who it is.	Huck
Boys, I know who's drownded--it's us!	Tom
What makes the candle blow so?	Polly
Why, that door's open, I believe. Why, of course it is. No end of strange things now. Go 'long and shut it, Sid.	Polly
But as I was saying, he warn't _bad_, so to say--only misch_ee_vous. Only just giddy, and harum-scarum, you know. He warn't any more responsible than a colt. _He_ never meant any harm, and he was the best-hearted boy that ever was.	Polly It was just so with my Joe--always full of his devilment, and up to every kind of mischief, but he was just as unselfish and kind as he could be--and laws bless me, to think I went and whipped him for taking that cream, never once recollecting that I throwed it out myself because it was sour, and I never to see him again in this world, never, never, never, poor abused boy!	MrsHarper
I hope Tom's better off where he is, but if he'd been better in some ways--	Sidney
Not a word against my Tom, now that he's gone! God'll take care of _him_--never you trouble _your_self, sir! Oh, Mrs. Harper, I don't know how to give him up! I don't know how to give him up! He was such a comfort to me, although he tormented my old heart out of me, 'most.	Polly
The Lord giveth and the Lord hath taken away--Blessed be the name of the Lord! But it's so hard--Oh, it's so hard! Only last Saturday my Joe busted a firecracker right under my nose and I knocked him sprawling. Little did I know then, how soon--Oh, if it was to do over again I'd hug him and bless him for it.	MrsHarper
Yes, yes, yes, I know just how you feel, Mrs. Harper, I know just exactly how you feel. No longer ago than yesterday noon, my Tom took and filled the cat full of Pain-killer, and I did think the cretur would tear the house down. And God forgive me, I cracked Tom's head with my thimble, poor boy, poor dead boy. But he's out of all his troubles now. And the last words I ever heard him say was to reproach--	Polly
No, Tom's true-blue, Huck, and he'll come back. He won't desert. He knows that would be a disgrace to a pirate, and Tom's too proud for that sort of thing. He's up to something or other. Now I wonder what?	JoeHarper
Well, the things is ours, anyway, ain't they?	Huck
Pretty near, but not yet, Huck. The writing says they are if he ain't back here to breakfast.	JoeHarper
Which he is!	Tom
I bet there's been pirates on this island before, boys. We'll explore it again. They've hid treasures here somewhere. How'd you feel to light on a rotten chest full of gold and silver--hey?	Tom
Oh, boys, let's give it up. I want to go home. It's so lonesome.	JoeHarper
Oh no, Joe, you'll feel better by and by.	Tom
Just think of the fishing that's here.	Tom
I don't care for fishing. I want to go home.	JoeHarper
But, Joe, there ain't such another swimming-place anywhere.	Tom
Swimming's no good. I don't seem to care for it, somehow, when there ain't anybody to say I sha'n't go in. I mean to go home.	JoeHarper
Oh, shucks! Baby! You want to see your mother, I reckon.	Tom
Yes, I _do_ want to see my mother--and you would, too, if you had one. I ain't any more baby than you are.	JoeHarper
Well, we'll let the crybaby go home to his mother, won't we, Huck? Poor thing--does it want to see its mother? And so it shall. You like it here, don't you, Huck? We'll stay, won't we?	Tom
Y-e-s	Huck
I'll never speak to you again as long as I live. There now!	JoeHarper
Who cares!	Tom
Nobody wants you to. Go 'long home and get laughed at. Oh, you're a nice pirate. Huck and me ain't crybabies. We'll stay, won't we, Huck? Let him go if he wants to. I reckon we can get along without him, per'aps.	Tom
I want to go, too, Tom. It was getting so lonesome anyway, and now it'll be worse. Let's us go, too, Tom.	Huck
I won't! You can all go, if you want to. I mean to stay.	Tom
Tom, I better go.	Huck
Well, go 'long--who's hendering you.	Tom
Tom, I wisht you'd come, too. Now you think it over. We'll wait for you when we get to shore.	Huck
Well, you'll wait a blame long time, that's all.	Tom
Wait! Wait! I want to tell you something!	Tom
Why, it's just as easy! If I'd a knowed this was all, I'd a learnt long ago.	Tom
So would I. It's just nothing.	JoeHarper
Why, many a time I've looked at people smoking, and thought well I wish I could do that; but I never thought I could,	Tom
That's just the way with me, hain't it, Huck? You've heard me talk just	Tom
that way--haven't you, Huck? I'll leave it to Huck if I haven't.	Tom Yes--heaps of times	Huck Well, I have too, oh, hundreds of times. Once down by the slaughter-house. Don't you remember, Huck? Bob Tanner was there, and Johnny Miller, and Jeff Thatcher, when I said it. Don't you remember, Huck, 'bout me saying that?	Tom
Yes, that's so. That was the day after I lost a white alley. No, 'twas the day before.	Huck
There--I told you so, Huck recollects it.	Tom
I bleeve I could smoke this pipe all day. I don't feel sick.	JoeHarper
Neither do I. I could smoke it all day. But I bet you Jeff Thatcher couldn't.	Tom
Jeff Thatcher! Why, he'd keel over just with two draws. Just let him try it once. _He'd_ see!	JoeHarper
I bet he would. And Johnny Miller--I wish could see Johnny Miller tackle it once.	Tom
Oh, don't I!	JoeHarper
Why, I bet you Johnny Miller couldn't any more do this than nothing. Just one little snifter would fetch _him_.	JoeHarper
'Deed it would, Joe. Say--I wish the boys could see us now.	Tom
So do I.	JoeHarper
Say--boys, don't say anything about it, and some time when they're around, I'll come up to you and say, 'Joe, got a pipe? I want a smoke.' And you'll say, kind of careless like, as if it warn't anything, you'll say, 'Yes, I got my _old_ pipe, and another one, but my tobacker ain't very good.' And I'll say, 'Oh, that's all right, if it's _strong_ enough.' And then you'll out with the pipes, and we'll light up just as ca'm, and then just see 'em look!	Tom
By jings, that'll be gay, Tom! I wish it was _now_!	JoeHarper
So do I! And when we tell 'em we learned when we was off pirating, won't they wish they'd been along?	Tom
Oh, I reckon not! I'll just _bet_ they will!	JoeHarper
I've lost my knife. I reckon I better go and find it.	JoeHarper
I'll help you. You go over that way and I'll hunt around by the spring. No, you needn't come, Huck--we can find it.	Tom
Quick! boys, go for the tent!	Tom
Oh, if I only had a brass andiron-knob again! But I haven't got anything now to remember him by.	Becky
It was right here. Oh, if it was to do over again, I wouldn't say that--I wouldn't say it for the whole world. But he's gone now; I'll never, never, never see him any more.	Becky
Aunt Polly, it ain't fair. Somebody's got to be glad to see Huck.	Tom
And so they shall. I'm glad to see him, poor motherless thing!	Polly
Well, I don't say it wasn't a fine joke, Tom, to keep everybody suffering 'most a week so you boys had a good time, but it is a pity you could be so hard-hearted as to let me suffer so. If you could come over on a log to go to your funeral, you could have come over and give me a hint some way that you warn't dead, but only run off.	Polly
Yes, you could have done that, Tom, and I believe you would if you had thought of it.	Mary
Would you, Tom?	Polly
Say, now, would you, if you'd thought of it?	Polly
I--well, I don't know. 'Twould 'a' spoiled everything.	Tom
Tom, I hoped you loved me that much. It would have been something if you'd cared enough to _think_ of it, even if you didn't _do_ it.	Polly
Now, auntie, that ain't any harm, it's only Tom's giddy way--he is always in such a rush that he never thinks of anything.	Mary
More's the pity. Sid would have thought. And Sid would have come and _done_ it, too. Tom, you'll look back, some day, when it's too late, and wish you'd cared a little more for me when it would have cost you so little.	Polly
Now, auntie, you know I do care for you	Tom
I'd know it better if you acted more like it.	Polly
I wish now I'd thought, but I dreamt about you, anyway. That's something, ain't it?	Tom
It ain't much--a cat does that much--but it's better than nothing. What did you dream?	Polly
Why, Wednesday night I dreamt that you was sitting over there by the bed, and Sid was sitting by the woodbox, and Mary next to him.	Tom
Well, so we did. So we always do. I'm glad your dreams could take even that much trouble about us.	Polly
And I dreamt that Joe Harper's mother was here.	Tom
Why, she was here! Did you dream any more?	Polly
Oh, lots. But it's so dim, now.	Tom
Well, try to recollect--can't you?	Polly
Somehow it seems to me that the wind--the wind blowed the--the--	Tom
Try harder, Tom! The wind did blow something. Come!	Polly
I've got it now! I've got it now! It blowed the candle!	Tom
Mercy on us! Go on, Tom--go on!	Polly
And it seems to me that you said, 'Why, I believe that that door--'	Tom
Go _on_, Tom!	Polly
Just let me study a moment--just a moment. Oh, yes--you said you believed the door was open.	Tom
As I'm sitting here, I did! Didn't I, Mary! Go on!	Polly
And then--and then--well I won't be certain, but it seems like as if you made Sid go and--and--	Tom
Well? Well? What did I make him do, Tom? What did I make him do?	Polly
You made him--you--Oh, you made him shut it.	Tom
Well, for the land's sake! I never heard the beat of that in all my days! Don't tell _me_ there ain't anything in dreams, any more. Sereny Harper shall know of this before I'm an hour older. I'd like to see her get around _this_ with her rubbage 'bout superstition. Go on, Tom!	Polly
