TOM!	Polly
Oh, it's all getting just as bright as day, now. Next you said I warn't _bad_, only mischeevous and harum-scarum, and not any more responsible than--than--I think it was a colt, or something.	Tom
And so it was! Well, goodness gracious! Go on, Tom!	Polly
And then you began to cry.	Tom
So I did. So I did. Not the first time, neither.	AuntPolly
Then Mrs. Harper she began to cry, and said Joe was just the same, and	Tom
she wished she hadn't whipped him for taking cream when she'd throwed it	Tom
out her own self--	Tom
Tom! The sperrit was upon you! You was a prophesying--that's what you was doing! Land alive, go on, Tom!	Polly
I don't think I said anything	Sidney
Yes you did, Sid. Shut your heads and let Tom go on! What did he say, Tom?	Mary
He said--I _think_ he said he hoped I was better off where I was gone to, but if I'd been better sometimes--	Tom
_There_, d'you hear that! It was his very words!	Polly
And you shut him up sharp.	Tom
I lay I did! There must 'a' been an angel there. There _was_ an angel there, somewheres!	Polly
And Mrs. Harper told about Joe scaring her with a firecracker, and you told about Peter and the Pain-killer--	Tom
Just as true as I live!	Polly
And then there was a whole lot of talk 'bout dragging the river for us, and 'bout having the funeral Sunday, and then you and old Miss Harper hugged and cried, and she went.	Tom
It happened just so! It happened just so, as sure as I'm a-sitting in these very tracks. Tom, you couldn't told it more like if you'd 'a' seen it! And then what? Go on, Tom!	Polly
Then I thought you prayed for me--and I could see you and hear every word you said. And you went to bed, and I was so sorry that I took and wrote on a piece of sycamore bark, 'We ain't dead--we are only off being pirates,' and put it on the table by the candle; and then you looked so good, laying there asleep, that I thought I went and leaned over and kissed you on the lips.	Tom
Did you, Tom, _did_ you! I just forgive you everything for that!	Polly
It was very kind, even though it was only a--dream	Sidney
Shut up, Sid! A body does just the same in a dream as he'd do if he was awake. Here's a big Milum apple I've been saving for you, Tom, if you was ever found again--now go 'long to school. I'm thankful to the good God and Father of us all I've got you back, that's long-suffering and merciful to them that believe on Him and keep His word, though goodness knows I'm unworthy of it, but if only the worthy ones got His blessings and had His hand to help them over the rough places, there's few enough would smile here or ever enter into His rest when the long night comes. Go 'long Sid, Mary, Tom--take yourselves off--you've hendered me long enough.	Polly
Why, Mary Austin! you bad girl, why didn't you come to Sunday-school?	Becky
I did come--didn't you see me?	MaryAustin
Why, no! Did you? Where did you sit?	Becky
I was in Miss Peters' class, where I always go. I saw _you_.	MaryAustin
Did you? Why, it's funny I didn't see you. I wanted to tell you about the picnic.	Becky
Oh, that's jolly. Who's going to give it?	MaryAustin
My ma's going to let me have one.	Becky
Oh, goody; I hope she'll let _me_ come.	MaryAustin
Well, she will. The picnic's for me. She'll let anybody come that I want, and I want you.	Becky
That's ever so nice. When is it going to be?	MaryAustin
By and by. Maybe about vacation.	Becky
Oh, won't it be fun! You going to have all the girls and boys?	MaryAustin
Yes, every one that's friends to me--or wants to be	Becky
Go away and leave me alone, can't you! I hate you!	Becky
Tom, I've a notion to skin you alive!	Polly
Auntie, what have I done?	Tom
Well, you've done enough. Here I go over to Sereny Harper, like an old softy, expecting I'm going to make her believe all that rubbage about that dream, when lo and behold you she'd found out from Joe that you was over here and heard all the talk we had that night. Tom, I don't know what is to become of a boy that will act like that. It makes me feel so bad to think you could let me go to Sereny Harper and make such a fool of myself and never say a word.	Polly
Auntie, I wish I hadn't done it--but I didn't think.	Tom
Oh, child, you never think. You never think of anything but your own selfishness. You could think to come all the way over here from Jackson's Island in the night to laugh at our troubles, and you could think to fool me with a lie about a dream; but you couldn't ever think to pity us and save us from sorrow.	Polly
Auntie, I know now it was mean, but I didn't mean to be mean. I didn't, honest. And besides, I didn't come over here to laugh at you that night.	Tom
What did you come for, then?	Polly
It was to tell you not to be uneasy about us, because we hadn't got drownded.	Tom
Tom, Tom, I would be the thankfullest soul in this world if I could believe you ever had as good a thought as that, but you know you never did--and I know it, Tom.	Polly
Indeed and 'deed I did, auntie--I wish I may never stir if I didn't.	Tom
Oh, Tom, don't lie--don't do it. It only makes things a hundred times worse.	Polly
It ain't a lie, auntie; it's the truth. I wanted to keep you from grieving--that was all that made me come.	Tom
I'd give the whole world to believe that--it would cover up a power of sins, Tom. I'd 'most be glad you'd run off and acted so bad. But it ain't reasonable; because, why didn't you tell me, child?	Polly
Why, you see, when you got to talking about the funeral, I just got all full of the idea of our coming and hiding in the church, and I couldn't somehow bear to spoil it. So I just put the bark back in my pocket and kept mum.	Tom
What bark?	Polly
The bark I had wrote on to tell you we'd gone pirating. I wish, now, you'd waked up when I kissed you--I do, honest.	Tom
_Did_ you kiss me, Tom?	Polly
Why, yes, I did.	Tom
Are you sure you did, Tom?	Polly
Why, yes, I did, auntie--certain sure.	Tom
What did you kiss me for, Tom?	Polly
Because I loved you so, and you laid there moaning and I was so sorry.	Tom
Kiss me again, Tom!--and be off with you to school, now, and don't bother me any more.	Polly
No, I don't dare. Poor boy, I reckon he's lied about it--but it's a blessed, blessed lie, there's such a comfort come from it. I hope the Lord--I _know_ the Lord will forgive him, because it was such good-heartedness in him to tell it. But I don't want to find out it's a lie. I won't look.	Polly
I could forgive the boy, now, if he'd committed a million sins!	Polly
I acted mighty mean today, Becky, and I'm so sorry. I won't ever, ever do that way again, as long as ever I live--please make up, won't you?	Tom
I'll thank you to keep yourself _to_ yourself, Mr. Thomas Sawyer. I'll never speak to you again.	Becky
Tom Sawyer, you are just as mean as you can be, to sneak up on a person and look at what they're looking at.	Becky
How could I know you was looking at anything?	Tom
_Be_ so mean if you want to! I know something that's going to happen. You just wait and you'll see! Hateful, hateful, hateful!	Becky
You ought to be ashamed of yourself, Tom Sawyer; you know you're going to tell on me, and oh, what shall I do, what shall I do! I'll be whipped, and I never was whipped in school.	Becky
What a curious kind of a fool a girl is! Never been licked in school! Shucks! What's a licking! That's just like a girl--they're so thin-skinned and chicken-hearted. Well, of course I ain't going to tell old Dobbins on this little fool, because there's other ways of getting even on her, that ain't so mean; but what of it? Old Dobbins will ask who it was tore his book. Nobody'll answer. Then he'll do just the way he always does--ask first one and then t'other, and when he comes to the right girl he'll know it, without any telling. Girls' faces always tell on them. They ain't got any backbone. She'll get licked. Well, it's a kind of a tight place for Becky Thatcher, because there ain't any way out of it."" Tom conned the thing a moment longer, and then added: ""All right, though; she'd like to see me in just such a fix--let her sweat it out!	Tom
Benjamin Rogers, did you tear this book?	Schoolmaster
Joseph Harper, did you?	Schoolmaster
Gracie Miller?	Schoolmaster
Susan Harper, did you do this?	Schoolmaster
Rebecca Thatcher did you tear--no, look me in the face--did you tear this book?	Schoolmaster
I done it!	Tom
Tom, how _could_ you be so noble!	Becky
Huck, have you ever told anybody about--that?	Tom
'Bout what?	Huck
You know what.	Tom
Oh--'course I haven't.	Huck
Never a word?	Tom
Never a solitary word, so help me. What makes you ask?	Huck
Well, I was afeard.	Tom
Why, Tom Sawyer, we wouldn't be alive two days if that got found out. _You_ know that.	Huck
Huck, they couldn't anybody get you to tell, could they?	Tom
Get me to tell? Why, if I wanted that halfbreed devil to drownd me they could get me to tell. They ain't no different way.	Huck
Well, that's all right, then. I reckon we're safe as long as we keep mum. But let's swear again, anyway. It's more surer.	Tom
I'm agreed.	Huck
What is the talk around, Huck? I've heard a power of it.	Tom
Talk? Well, it's just Muff Potter, Muff Potter, Muff Potter all the	Huck
time. It keeps me in a sweat, constant, so's I want to hide som'ers.	Huck That's just the same way they go on round me. I reckon he's a goner. Don't you feel sorry for him, sometimes?	Tom Most always--most always. He ain't no account; but then he hain't ever done anything to hurt anybody. Just fishes a little, to get money to get drunk on--and loafs around considerable; but lord, we all do that--leastways most of us--preachers and such like. But he's kind of good--he give me half a fish, once, when there warn't enough for two; and lots of times he's kind of stood by me when I was out of luck.	Huck
Well, he's mended kites for me, Huck, and knitted hooks on to my line. I wish we could get him out of there.	Tom
My! we couldn't get him out, Tom. And besides, 'twouldn't do any good; they'd ketch him again.	Huck
Yes--so they would. But I hate to hear 'em abuse him so like the dickens when he never done--that.	Tom
I do too, Tom. Lord, I hear 'em say he's the bloodiest looking villain in this country, and they wonder he wasn't ever hung before.	Huck
Yes, they talk like that, all the time. I've heard 'em say that if he was to get free they'd lynch him.	Tom
And they'd do it, too.	Huck
You've been mighty good to me, boys--better'n anybody else in this town. And I don't forget it, I don't. Often I says to myself, says I, 'I used to mend all the boys' kites and things, and show 'em where the good fishin' places was, and befriend 'em what I could, and now they've all forgot old Muff when he's in trouble; but Tom don't, and Huck don't--_they_ don't forget him, says I, 'and I don't forget them.' Well, boys, I done an awful thing--drunk and crazy at the time--that's the only way I account for it--and now I got to swing for it, and it's right. Right, and _best_, too, I reckon--hope so, anyway. Well, we won't talk about that. I don't want to make _you_ feel bad; you've befriended me. But what I want to say, is, don't _you_ ever get drunk--then you won't ever get here. Stand a litter furder west--so--that's it; it's a prime comfort to see faces that's friendly when a body's in such a muck of trouble, and there don't none come here but yourn. Good friendly faces--good friendly faces. Git up on one another's backs and let me touch 'em. That's it. Shake hands--yourn'll come through the bars, but mine's too big. Little hands, and weak--but they've helped Muff Potter a power, and they'd help him more if they could.	Potter
Your honor, in our remarks at the opening of this trial, we foreshadowed our purpose to prove that our client did this fearful deed while under the influence of a blind and irresponsible delirium produced by drink. We have changed our mind. We shall not offer that plea. Call Thomas Sawyer!	PotterLawyer
Thomas Sawyer, where were you on the seventeenth of June, about the hour of midnight?	PotterLawyer
In the graveyard!	Tom
A little bit louder, please. Don't be afraid. You were--	PotterLawyer
In the graveyard.	Tom
Were you anywhere near Horse Williams' grave?	PotterLawyer
Yes, sir.	Tom
Speak up--just a trifle louder. How near were you?	PotterLawyer
Near as I am to you.	Tom
Were you hidden, or not?	PotterLawyer
I was hid.	Tom
Where?	PotterLawyer
Behind the elms that's on the edge of the grave.	Tom
Any one with you?	PotterLawyer
Yes, sir. I went there with--	Tom
Wait--wait a moment. Never mind mentioning your companion's name. We will produce him at the proper time. Did you carry anything there with you.	PotterLawyer
Speak out, my boy--don't be diffident. The truth is always respectable. What did you take there?	PotterLawyer
Only a--a--dead cat.	Tom
We will produce the skeleton of that cat. Now, my boy, tell us everything that occurred--tell it in your own way--don't skip anything, and don't be afraid.	PotterLawyer
--and as the doctor fetched the board around and Muff Potter fell, Injun Joe jumped with the knife and--	Tom
Where'll we dig?	Huck
Oh, most anywhere.	Tom
Why, is it hid all around?	Huck
No, indeed it ain't. It's hid in mighty particular places, Huck--sometimes on islands, sometimes in rotten chests under the end of a limb of an old dead tree, just where the shadow falls at midnight; but mostly under the floor in ha'nted houses.	Tom
Who hides it?	Huck
Why, robbers, of course--who'd you reckon? Sunday-school sup'rintendents?	Tom
I don't know. If 'twas mine I wouldn't hide it; I'd spend it and have a good time.	Huck
So would I. But robbers don't do that way. They always hide it and leave it there.	Tom
Don't they come after it any more?	Huck
No, they think they will, but they generally forget the marks, or else they die. Anyway, it lays there a long time and gets rusty; and by and by somebody finds an old yellow paper that tells how to find the marks--a paper that's got to be ciphered over about a week because it's mostly signs and hy'roglyphics.	Tom
Hyro--which?	Huck
Hy'roglyphics--pictures and things, you know, that don't seem to mean anything.	Tom
Have you got one of them papers, Tom?	Huck
No.	Tom
Well then, how you going to find the marks?	Huck
I don't want any marks. They always bury it under a ha'nted house or on an island, or under a dead tree that's got one limb sticking out. Well, we've tried Jackson's Island a little, and we can try it again some time; and there's the old ha'nted house up the Still-House branch, and there's lots of dead-limb trees--dead loads of 'em.	Tom
Is it under all of them?	Huck
How you talk! No!	Tom
Then how you going to know which one to go for?	Huck
Go for all of 'em!	Tom
Why, Tom, it'll take all summer.	Huck
Well, what of that? Suppose you find a brass pot with a hundred dollars in it, all rusty and gray, or rotten chest full of di'monds. How's that?	Tom
That's bully. Plenty bully enough for me. Just you gimme the hundred dollars and I don't want no di'monds.	Huck
All right. But I bet you I ain't going to throw off on di'monds. Some of 'em's worth twenty dollars apiece--there ain't any, hardly, but's worth six bits or a dollar.	Tom
No! Is that so?	Huck
Cert'nly--anybody'll tell you so. Hain't you ever seen one, Huck?	Tom
Not as I remember.	Huck
Oh, kings have slathers of them.	Tom
Well, I don' know no kings, Tom.	Huck
I reckon you don't. But if you was to go to Europe you'd see a raft of 'em hopping around.	Tom
Do they hop?	Huck
Hop?--your granny! No!	Tom
Well, what did you say they did, for?	Huck
Shucks, I only meant you'd _see_ 'em--not hopping, of course--what do they want to hop for?--but I mean you'd just see 'em--scattered around, you know, in a kind of a general way. Like that old humpbacked Richard.	Tom
Richard? What's his other name?	Huck
He didn't have any other name. Kings don't have any but a given name.	Tom
No?	Huck
But they don't.	Tom
Well, if they like it, Tom, all right; but I don't want to be a king and have only just a given name, like a nigger. But say--where you going to dig first?	Huck
Well, I don't know. S'pose we tackle that old dead-limb tree on the hill t'other side of Still-House branch?	Tom
I'm agreed.	Huck
I like this	Tom
So do I.	Huck
Say, Huck, if we find a treasure here, what you going to do with your share?	Tom
Well, I'll have pie and a glass of soda every day, and I'll go to every circus that comes along. I bet I'll have a gay time.	Huck
Well, ain't you going to save any of it?	Tom
Save it? What for?	Huck
Why, so as to have something to live on, by and by.	Tom
Oh, that ain't any use. Pap would come back to thish-yer town some day and get his claws on it if I didn't hurry up, and I tell you he'd clean it out pretty quick. What you going to do with yourn, Tom?	Huck
I'm going to buy a new drum, and a sure'nough sword, and a red necktie and a bull pup, and get married.	Tom
Married!	Huck
That's it.	Tom
Tom, you--why, you ain't in your right mind.	Huck
Wait--you'll see.	Tom
Well, that's the foolishest thing you could do. Look at pap and my mother. Fight! Why, they used to fight all the time. I remember, mighty well.	Huck
That ain't anything. The girl I'm going to marry won't fight.	Tom
Tom, I reckon they're all alike. They'll all comb a body. Now you better think 'bout this awhile. I tell you you better. What's the name of the gal?	Huck
It ain't a gal at all--it's a girl.	Tom
It's all the same, I reckon; some says gal, some says girl--both's right, like enough. Anyway, what's her name, Tom?	Huck
I'll tell you some time--not now.	Tom
All right--that'll do. Only if you get married I'll be more lonesomer than ever.	Huck
No you won't. You'll come and live with me. Now stir out of this and we'll go to digging.	Tom
Do they always bury it as deep as this?	Huck
Sometimes--not always. Not generally. I reckon we haven't got the right place.	Tom
Where you going to dig next, after we get this one?	Huck
I reckon maybe we'll tackle the old tree that's over yonder on Cardiff Hill back of the widow's.	Tom
I reckon that'll be a good one. But won't the widow take it away from us, Tom? It's on her land.	Huck
_She_ take it away! Maybe she'd like to try it once. Whoever finds one of these hid treasures, it belongs to him. It don't make any difference whose land it's on.	Tom
Blame it, we must be in the wrong place again. What do you think?	Huck
It is mighty curious, Huck. I don't understand it. Sometimes witches interfere. I reckon maybe that's what's the trouble now.	Tom
Shucks! Witches ain't got no power in the daytime.	Huck
Well, that's so. I didn't think of that. Oh, I know what the matter is! What a blamed lot of fools we are! You got to find out where the shadow of the limb falls at midnight, and that's where you dig!	Tom
Then consound it, we've fooled away all this work for nothing. Now hang it all, we got to come back in the night. It's an awful long way. Can you get out?	Huck
I bet I will. We've got to do it tonight, too, because if somebody sees these holes they'll know in a minute what's here and they'll go for it.	Tom
Well, I'll come around and maow tonight.	Huck
All right. Let's hide the tools in the bushes.	Tom
It ain't any use, Huck, we're wrong again.	Tom
Well, but we _can't_ be wrong. We spotted the shadder to a dot.	Huck
I know it, but then there's another thing.	Tom
What's that?	Huck
Why, we only guessed at the time. Like enough it was too late or too early.	Tom
That's it, That's the very trouble. We got to give this one up. We can't ever tell the right time, and besides this kind of thing's too awful, here this time of night with witches and ghosts a-fluttering around so. I feel as if something's behind me all the time; and I'm afeard to turn around, becuz maybe there's others in front a-waiting for a chance. I been creeping all over, ever since I got here.	Huck
Well, I've been pretty much so, too, Huck. They most always put in a dead man when they bury a treasure under a tree, to look out for it.	Tom
Lordy!	Huck
Yes, they do. I've always heard that.	Tom
Tom, I don't like to fool around much where there's dead people. A body's bound to get into trouble with 'em, sure.	Huck
I don't like to stir 'em up, either. S'pose this one here was to stick his skull out and say something!	Tom
Don't Tom! It's awful.	Huck
Well, it just is. Huck, I don't feel comfortable a bit.	Tom
Say, Tom, let's give this place up, and try somewheres else.	Huck
All right, I reckon we better.	Tom
What'll it be?	Huck
The ha'nted house. That's it!	Tom
Blame it, I don't like ha'nted houses, Tom. Why, they're a dern sight worse'n dead people. Dead people might talk, maybe, but they don't come sliding around in a shroud, when you ain't noticing, and peep over your shoulder all of a sudden and grit their teeth, the way a ghost does. I couldn't stand such a thing as that, Tom--nobody could.	Huck
Yes, but, Huck, ghosts don't travel around only at night. They won't hender us from digging there in the daytime.	Tom
Well, that's so. But you know mighty well people don't go about that ha'nted house in the day nor the night.	Huck
Well, that's mostly because they don't like to go where a man's been murdered, anyway--but nothing's ever been seen around that house except in the night--just some blue lights slipping by the windows--no regular ghosts.	Tom
Well, where you see one of them blue lights flickering around, Tom, you can bet there's a ghost mighty close behind it. It stands to reason. Becuz you know that they don't anybody but ghosts use 'em.	Huck
Yes, that's so. But anyway they don't come around in the daytime, so what's the use of our being afeard?	Tom
Well, all right. We'll tackle the ha'nted house if you say so--but I reckon it's taking chances.	Huck
Lookyhere, Tom, do you know what day it is?	Huck
My! I never once thought of it, Huck!	Tom
Well, I didn't neither, but all at once it popped onto me that it was Friday.	Huck
Blame it, a body can't be too careful, Huck. We might 'a' got into an awful scrape, tackling such a thing on a Friday.	Tom
_Might_! Better say we _would_! There's some lucky days, maybe, but Friday ain't.	Huck
Any fool knows that. I don't reckon _you_ was the first that found it out, Huck.	Tom
Well, I never said I was, did I? And Friday ain't all, neither. I had a rotten bad dream last night--dreampt about rats.	Huck
No! Sure sign of trouble. Did they fight?	Tom
No.	Huck
Well, that's good, Huck. When they don't fight it's only a sign that there's trouble around, you know. All we got to do is to look mighty sharp and keep out of it. We'll drop this thing for today, and play. Do you know Robin Hood, Huck?	Tom
No. Who's Robin Hood?	Huck
Why, he was one of the greatest men that was ever in England--and the best. He was a robber.	Tom
Cracky, I wisht I was. Who did he rob?	Huck
Only sheriffs and bishops and rich people and kings, and such like. But he never bothered the poor. He loved 'em. He always divided up with 'em perfectly square.	Tom
Well, he must 'a' been a brick.	Huck
I bet you he was, Huck. Oh, he was the noblest man that ever was. They ain't any such men now, I can tell you. He could lick any man in England, with one hand tied behind him; and he could take his yew bow and plug a ten-cent piece every time, a mile and a half.	Tom
What's a _yew_ bow?	Huck
I don't know. It's some kind of a bow, of course. And if he hit that dime only on the edge he would set down and cry--and curse. But we'll play Robin Hood--it's nobby fun. I'll learn you.	Tom
I'm agreed.	Huck
Sh!	Tom
What is it?	Huck
Sh!... There!... Hear it?	Tom
Yes!... Oh, my! Let's run!	Huck
Keep still! Don't you budge! They're coming right toward the door.	Tom
They've stopped.... No--coming.... Here they are. Don't whisper another word, Huck. My goodness, I wish I was out of this!	Tom
No, I've thought it all over, and I don't like it. It's dangerous.	Robber
Dangerous!	InjunJoe
Milksop!	InjunJoe
What's any more dangerous than that job up yonder--but nothing's come of it.	InjunJoe
That's different. Away up the river so, and not another house about. 'Twon't ever be known that we tried, anyway, long as we didn't succeed.	Robber
Well, what's more dangerous than coming here in the daytime!--anybody would suspicion us that saw us.	InjunJoe
I know that. But there warn't any other place as handy after that fool of a job. I want to quit this shanty. I wanted to yesterday, only it warn't any use trying to stir out of here, with those infernal boys playing over there on the hill right in full view.	Robber
Look here, lad--you go back up the river where you belong. Wait there till you hear from me. I'll take the chances on dropping into this town just once more, for a look. We'll do that 'dangerous' job after I've spied around a little and think things look well for it. Then for Texas! We'll leg it together!	InjunJoe
I'm dead for sleep! It's your turn to watch.	InjunJoe
Now's our chance--come!	Tom
I can't--I'd die if they was to wake.	Huck
Here! _You're_ a watchman, ain't you! All right, though--nothing's happened.	InjunJoe
My! have I been asleep?	Robber
Oh, partly, partly. Nearly time for us to be moving, pard. What'll we do with what little swag we've got left?	InjunJoe
I don't know--leave it here as we've always done, I reckon. No use to take it away till we start south. Six hundred and fifty in silver's something to carry.	Robber
Well--all right--it won't matter to come here once more.	InjunJoe
No--but I'd say come in the night as we used to do--it's better.	Robber
Yes: but look here; it may be a good while before I get the right chance at that job; accidents might happen; 'tain't in such a very good place; we'll just regularly bury it--and bury it deep.	InjunJoe
Good idea	Robber
Hello!	InjunJoe
What is it?	Robber
